provider,clean_text,amount
airtel,airtelmoneyug charges nssfug daily savers 3x money senders saving 50k daily with smartlife earns 1180k interestyear  airtel takes 570k 1600x30x12gt50 of interest nssfug gives with 1 hand and stopairteltheft takes with another hand spirejim,50000.0
airtel,niwarodgers airtelug spirejim i stopped in 2022 after they stole my 250k,250000.0
mtn,spirejim airtelug after duopolising the communication sector airtel and mtn feel less concerned about our challenges with them i implore u guys to run to lycamobile for data tho to load it still u need one of them however let me give my 30k per month to this new comer than to perennial thieves,30000.0
airtel,"spirejim airtelug airtelmoneyug my phone was stolen my 800k was withdrawn and they borrowed 400k leaving me with a debt 
 stopairteltheft",800000.0
airtel,spirejim airtelug agoracfr airtelmoneyug good morning mr jim today morning the same scenario happened again i sent 114m using airtel money but the money isnt on my airtel money account and didnt reach the  destination but theres no any clear response where my money is please help me sir,114000000.0
airtel,kiryaug spirejim airtelug agoracfr airtelmoneyug i think after that we can start on uedclgbt coz how can i buy lightyaka0f 20k and get 5units,20000.0
airtel,spirejim airtelug agoracfr airtelmoneyug drababii babano same exact price different bundles also when did 5k of money give you 170mbs,5000.0
mtn,"spirejim airtelug i think i also have obujulizi nti bank abasaja babbieven to the extent that this waa a mobile money agentlost with commission expected over 500konly to tell us mbu the number had been out of usethere is no way they can assure me of safety
if u want all the det",500000.0
mtn,"spirejim airtelug agoracfr airtelmoneyug lets hope its not another pr stunt where they speak grammar dodge questions and promise investigations that never see daylight we want action refunds and accountabilitynot another airtel bedtime stories

my 800k
i will never forgive airtelmoney",800000.0
mtn,spirejim airtelug agoracfr airtelmoneyug they scammed me 40m,40000000.0
airtel,spirejim airtelug agoracfr airtelmoneyug has he agreed to pay back my 400k i lost on their line,400000.0
airtel,"spirejim airtelmoneyug airtel made me fail to reverse my 50kafter one year of complaining and no help i was told to process a court order
the guys we talk to  100 are so incompetent",50000.0
airtel,"spirejim airtelug agoracfr airtelmoneyug but spirejim  do you know that we can also have the m7mustresign campaign and he goes
the way you have squeezed airtelug and airtelmoneyug to this compromise is amazing
keep going",7000000.0
